series_id,event_id,tags,event_title,event_sub_title,platform
housect5,housect5-26,elections,which party will win the house race for ct-05,in 2026,kalshi
houseco8,houseco8-26,elections,which party will win the house race for co-08,in 2026,kalshi
houseco3,houseco3-26,elections,which party will win the house race for co-03,in 2026,kalshi
houseca9,houseca9-26,elections,which party will win the house race for ca-09,in 2026,kalshi
houseca49,houseca49-26,elections,which party will win the house race for ca-49,in 2026,kalshi
houseca47,houseca47-26,elections,which party will win the house race for ca-47,in 2026,kalshi
houseca45,houseca45-26,elections,which party will win the house race for ca-45,in 2026,kalshi
houseca41,houseca41-26,elections,which party will win the house race for ca-41,in 2026,kalshi
houseca40,houseca40-26,elections,which party will win the house race for ca-40,in 2026,kalshi
houseca3,houseca3-26,elections,which party will win the house race for ca-03,in 2026,kalshi
houseca27,houseca27-26,elections,which party will win the house race for ca-27,in 2026,kalshi
houseca22,houseca22-26,elections,which party will win the house race for ca-22,in 2026,kalshi
houseca21,houseca21-26,elections,which party will win the house race for ca-21,in 2026,kalshi
houseca13,houseca13-26,elections,which party will win the house race for ca-13,in 2026,kalshi
houseaz6,houseaz6-26,elections,which party will win the house race for az-06,in 2026,kalshi
houseaz2,houseaz2-26,elections,which party will win the house race for az-02,in 2026,kalshi
houseaz1,houseaz1-26,elections,which party will win the house race for az-01,in 2026,kalshi
houseakal,houseakal-26,elections,which party will win the house race for alaska,in 2026,kalshi
kxtxhousedemseats,kxtxhousedemseats-26nov03,elections,how many house seats will democrats win in texas,"on nov 3, 2026",kalshi
kxsecstatenv,kxsecstatenv-26,elections,nevada secretary of state winner,in 2026,kalshi
kxsecstateaz,kxsecstateaz-26,elections,arizona secretary of state winner,in 2026,kalshi
kxclosestsenate,kxclosestsenate-27jan03,elections,closest senate race in 2026,"before jan 3, 2027",kalshi
kxattygensd,kxattygensd-26,elections,south dakota attorney general winner,in 2026,kalshi
kxattygenid,kxattygenid-26,elections,win the attorney general race in idaho,in 2026,kalshi
kxattygenaz,kxattygenaz-26,elections,arizona attorney general winner,in 2026,kalshi
kxuponly,kxuponly-01,entertainment,which guests will appear on the uponly podcast by 2027,before 2027,kalshi
kxtrumposhea,kxtrumposhea-01,entertainment,trump go on sourcery with molly o'shea before 2027,before jan 2027,kalshi
kxtopai,kxtopai-27,science and technology,which companies will have a top-ranked ai model this year,in 2026,kalshi
kxreccount,kxreccount-27,politics,how many reconciliation bills will be passed in 2026,in 2027,kalshi
kxmediaguestmmarks,kxmediaguestmmarks-27,entertainment,meredith marks appear in an episode of rhoslc,before 2027,kalshi
kxmediaguestkimmel,kxmediaguestkimmel-27,entertainment,go on jimmy kimmel,before 2027,kalshi
kxmediaguestjakeshane,kxmediaguestjakeshane-27,entertainment,jake shane go on dancing with the stars this year,before 2027,kalshi
kxmediaguestfallon,kxmediaguestfallon-27,entertainment,go on jimmy fallon,before 2027,kalshi
kxmediaguestericadams,kxmediaguestericadams-27,entertainment,eric adams go on dancing with the stars this year,before 2027,kalshi
kxkxmediaguesttinydesk,kxkxmediaguesttinydesk-27,entertainment,go on tiny desk this year,before 2027,kalshi
kxfollowercountishowspeed,kxfollowercountishowspeed,social,when will ishowspeed reach 5 million twitch followers,"before jan 1, 2027",kalshi
kxfedmeet,kxfedmeet-27,economics,fed have an emergency meeting in 2026,in 2026,kalshi
kxcollegegamedayguest,kxcollegegamedayguest-26cgd,sports,johnny manziel go on espn's college gameday before 2027,johnny manziel,kalshi
kxattygenri,kxattygenri-26,elections,win the attorney general race in rhode island,in 2026,kalshi
kxattygenny,kxattygenny-26,elections,new york attorney general winner,in 2026,kalshi
kxattygennm,kxattygennm-26,elections,win the attorney general race in new mexico,in 2026,kalshi
kxattygenmi,kxattygenmi-26,elections,michigan attorney general winner,in 2026,kalshi
kxattygende,kxattygende-26,elections,win the attorney general race in delaware,in 2026,kalshi
kxaispike,kxaispike-27,science and technology,ai capability growth this year,before 2027,kalshi
govpartynv,govpartynv-26,elections,nevada governor winner,in 2026,kalshi
govpartyme,govpartyme-26,elections,maine governor winner,in 2026,kalshi
govpartyaz,govpartyaz-26,elections,arizona governor winner,in 2026,kalshi
kxvpbreaks,kxvpbreaks-26,politics,how many ties will j.d. vance break in 2026,in 2026,kalshi
kxtop3wealth,kxtop3wealth-26dec31,economics,be the three wealthiest people in the world,"on dec 31, 2026",kalshi
kxroleinproductiondoomsday,kxroleinproductiondoomsday,entertainment,avengers: doomsday cast,avengers: doomsday,kalshi
kxperformrolejeangrey,kxperformrolejeangrey,entertainment,sadie sink be the next jean grey,play jean grey,kalshi
kxalbumreleasetravye,kxalbumreleasetravye-27,entertainment,ye and travis scott release a joint album this year,2026,kalshi
kxalbumreleasenbayb,kxalbumreleasenbayb-27,entertainment,youngboy never broke again release another album this year,"february 13, 2026 at 10:00:00am eastern time and ending on december 31, 2026 at 11:59:59pm eastern time",kalshi
kxngasmin,kxngasmin-26dec31,economics,lowest natural gas spot price in​ 2026,in 2026,kalshi
kxngasmax,kxngasmax-26dec31,economics,highest natural gas spot price in​ 2026,in 2026,kalshi
kxalbumrelease,kxalbumrelease-26,entertainment,release a new album in 2026,2026,kalshi
kxwbcwelterweighttitle,kxwbcwelterweighttitle-27,sports,"wbc welterweight title on january 1, 2027","jan 1, 2027",kalshi
kxwbcflyweighttitle,kxwbcflyweighttitle-27,sports,"wbc flyweight title on january 1, 2027","jan 1, 2027",kalshi
kxwbcfeatherweighttitle,kxwbcfeatherweighttitle-27,sports,"wbc featherweight title on january 1, 2027","jan 1, 2027",kalshi
kxwbccruiserweighttitle,kxwbccruiserweighttitle-27,sports,"wbc cruiserweight title on january 1, 2027","jan 1, 2027",kalshi
kxwbcbantamweighttitle,kxwbcbantamweighttitle-27,sports,"wbc bantamweight title on january 1, 2027","jan 1, 2027",kalshi
kxaaagasmintx,kxaaagasmintx-26dec31,economics,how low will gas prices in texas get this year,in 2026,kalshi
kxaaagasminny,kxaaagasminny-26dec31,economics,how low will gas prices in new york get this year,in 2026,kalshi
kxaaagasminfl,kxaaagasminfl-26dec31,economics,how low will gas prices in florida get this year,in 2026,kalshi
kxaaagasminca,kxaaagasminca-26dec31,economics,how low will gas prices in california get this year,in 2026,kalshi
kxaaagasmaxtx,kxaaagasmaxtx-26dec31,economics,how high will gas prices in texas get this year,in 2026,kalshi
kxaaagasmaxny,kxaaagasmaxny-26dec31,economics,how high will gas prices in new york get this year,in 2026,kalshi
kxaaagasmaxfl,kxaaagasmaxfl-26dec31,economics,how high will gas prices in florida get this year,in 2026,kalshi
kxaaagasmaxca,kxaaagasmaxca-26dec31,economics,how high will gas prices in california get this year,in 2026,kalshi
kxscotref,scotref-27,elections,scottish independence referendum called in 2026,before 2027,kalshi
kxzerorate,kxzerorate-2026,economics,rates hit zero in 2026,in 2026,kalshi
kxytubesubsbeast,kxytubesubsbeast,entertainment,mrbeast reach 500 million subscribers this year,in 2026,kalshi
kxxaigame,kxxaigame-27,companies,xai release a video game before 2027,before 2027,kalshi
kxwtimax,kxwtimax-26dec31,financials,"how high will wti oil get by dec 31, 2026",in 2026,kalshi
kxwtaserena,kxwtaserena-26,sports,serena williams to compete in any wta tournament in 2026,serena williams,kalshi
kxwnbagamesplayed,kxwnbagamesplayed-26binary,sports,at least 1 game be played in the pro women's basketball season,2026 1 game,kalshi
kxwnbagamesplayed,kxwnbagamesplayed-26,sports,how many games will be played in the pro women's basketball season,2026 total games,kalshi
kxwnbadelay,kxwnbadelay-26,sports,how long will the pro women's basketball season be delayed,2026,kalshi
kxwinstreakmanu,kxwinstreakmanu-27,sports,manchester united win 5 in a row this year,2026,kalshi
kxwhvisit,kxwhvisit-27,politics,visit the white house before 2027,before jan 2027,kalshi
kxwbcmiddleweighttitle,kxwbcmiddleweighttitle-27,sports,"wbc middleweight title on january 1, 2027","jan 1, 2027",kalshi
kxwbclightweighttitle,kxwbclightweighttitle-27,sports,"wbc lightweight title on january 1, 2027","jan 1, 2027",kalshi
kxwbcheavyweighttitle,kxwbcheavyweighttitle-27,sports,"wbc heavyweight title on january 1, 2027","jan 1, 2027",kalshi
kxvoteshutdowns,kxvoteshutdowns-jan27,politics,vote for the next government funding bill in the senate,before 2027,kalshi
kxvotefedchair,kxvotefedchair-27,politics,which senators will vote for kevin warsh as fed chair,before 2027,kalshi
kxvine,kxvine-26,companies,x re-launches vine this year,in 2026,kalshi
kxvetocount,kxvetocount-27jan,politics,how many bills with trump veto in 2026,before 2027,kalshi
kxvaccinerec,kxvaccinerec-27,politics,which vaccines will the cdc no longer recommend in 2026,"before jan 1, 2027",kalshi
kxusmdlfrdm,kxusmdlfrdm-27,world,receive the presidential medal of freedom before 2027,in 2027,kalshi
kxusfundhead,kxusfundhead-27,financials,join trump's sovereign wealth fund before 2027,before 2027,kalshi
kxusfund,kxusfund-27,politics,u.s. sovereign wealth fund be operational before 2027,before 2027,kalshi
kxusdbrlmax,kxusdbrlmax-26dec31,financials,usd/brl high in 20​26,in 20​26,kalshi
kxusairanagreement,kxusairanagreement-27,politics,us-iran nuclear deal,in 2026,kalshi
kxusacompanystake,kxusacompanystake-27jan01,companies,which companies will the us take a stake in this year,"before jan 1, 2027",kalshi
kxuapfiles,kxuapfiles-27,politics,trump release new ufo files before 2027,in 2027,kalshi
kxtwow,kxtwow-27,entertainment,winds of winter release date announced this year,in 2026,kalshi
kxtwitchsubsninja,kxtwitchsubsninja-27jan01,social,ninja reach at least 10k twitch subscribers this year,"before jan 1, 2027",kalshi
kxtwitchsubskaicenat,kxtwitchsubskaicenat-27jan01,social,how many twitch subscribers will kaicenat reach this year,"before jan 1, 2027",kalshi
kxtvshowscancelled,kxtvshowscancelled-27,entertainment,which tv shows will be cancelled this year,before 2027,kalshi
kxtvseasonreleaseoutbanks,kxtvseasonreleaseoutbanks,entertainment,when will outer banks season 5 be released,outer banks season 5,kalshi
kxtvseasonannouncest,kxtvseasonannouncest-27,entertainment,new season of stranger things be announced,before 2027,kalshi
kxtryfirepowell,kxtryfirepowell-26may12,politics,trump try to fire powell as fed chair or governor,before 2027,kalshi
kxtrumptariffhear,kxtrumptariffhear-27jan,politics,supreme court hear a case on trump's tariffs in 2026,before jan 2027,kalshi
kxtrumpstates,kxtrumpstates-27jan01,world,which states will trump visit before 2027,"before jan 1, 2027",kalshi
kxtrumppardon,kxtrumppardon-27jan01,politics,trump pardon in 2026,"before jan 1, 2027",kalshi
kxtrumpout27,kxtrumpout27-27,elections,donald trump out as president,before 2027,kalshi
kxtrumpmeeting,kxtrumpmeeting-27jan01,politics,donald trump meet in 2026,"before jan 1, 2027",kalshi
kxtrumpfire,kxtrumpfire-27,politics,how many cabinet members will trump fire in 2026,before 2027,kalshi
kxtrumpdollar,kxtrumpdollar-26,politics,us mint finalize a design for the trump dollar before 2027,in 2026,kalshi
kxtrumpcountries,kxtrumpcountries-27jan01,politics,what countries will trump visit in 2026,"before jan 1, 2027",kalshi
kxtrumpchina,kxtrumpchina-26,politics,when will trump visit china,donald trump visit to china,kalshi
kxtraveldowngrade,kxtraveldowngrade-27jan01,politics,which countries will have their us travel advisory downgraded in 2026,"before jan 1, 2027",kalshi
kxtransgendersportsban,kxtransgendersportsban,politics,supreme court uphold transgender sports bans,before 2027,kalshi
kxtradedealcuba,kxtradedealcuba-27,politics,trump announce a trade deal with cuba,cuba,kalshi
kxtour,kxtour-27,entertainment,announce a new tour this year,in 2027,kalshi
kxtime,kxtime-26,entertainment,time's person of the year for 2026,in 2026,kalshi
kxthemaskedsinger,kxthemaskedsinger-27jan01,entertainment,win the masked singer: season 14,the masked singer: season 14,kalshi
kxteslasemi,kxteslasemi-27jan,companies,how many semi trucks will tesla produce in a quarter in 2026,before jan 2027,kalshi
kxteslaroadster,kxteslaroadster-27,companies,tesla roadsters delivered this year,in 2026,kalshi
kxteslaenergyby,kxteslaenergyby-27,companies,how much will tesla's energy business grow before 2027,before 2027,kalshi
kxtesladeliveryby,kxtesladeliveryby-27,companies,how much will tesla deliveries grow this year,before 2027,kalshi
kxteslacar,kxteslacar-27,companies,"tesla release a two door model y car for usd 30,000 or less before 2027",in 2027,kalshi
kxtariffsector,kxtariffsector-27jan01,politics,which sectors will trump tariff in 2026,in 2026,kalshi
kxtariffbill,kxtariffbill,politics,new tariffs become law,new tariffs,kalshi
kxsupremecourtcharge,kxsupremecourtcharge-27jan01,politics,any supreme court justice be charged with a federal crime,"before jan 1, 2027",kalshi
kxsubway,kxsubway-27,companies,nyc subway ridership reach its pre-covid average,before 2027,kalshi
kxstockbanhouse,kxstockbanhouse,politics,house vote to ban members of congress from trading stocks,"legislation that prohibits members of congress from purchasing stocks, even if it allows for purchasing stocks via a blind trust or the purchase of “diversified assets” (such as etfs or mutual funds)",kalshi
kxstefondiggscardib,kxstefondiggscardib-26,entertainment,cardi b and stefon diggs be engaged in 2026,before 2027,kalshi
kxsteamprice,kxsteamprice-27,companies,how much will the steam machine cost,before 2027,kalshi
kxstarwars,kxstarwars-27,entertainment,new star wars movie released in theaters before 2027,before 2027,kalshi
kxspotifyalbumreleasedatebabyboi,kxspotifyalbumreleasedatebabyboi-27,entertainment,playboi carti release baby boi this year,before jan 2027,kalshi
kxspinofftellmelies,kxspinofftellmelies-27,entertainment,tell me lies have a spin-off announced this year,in 2026,kalshi
kxspainbullfighting,kxspainbullfighting-27jan01,politics,spain ban bullfighting before 2027,"before jan 1, 2027",kalshi
kxsongrelease,kxsongrelease-27jan01,entertainment,release a new song this year,2026,kalshi
kxsocialmediaban,kxsocialmediaban-27jan01,politics,us bans social media for children in 2026,"before jan 1, 2027",kalshi
kxsnapuk,kxsnapuk-27jan01,elections,early elections in the uk be announced before 2027,"before jan 1, 2027",kalshi
kxsnapelectionfr,kxsnapelectionfr,elections,when will france announce a snap election,before 2027,kalshi
kxshowendhauntedhotel,kxshowendhauntedhotel-27,entertainment,there be an announcement that netflix’s haunted hotel is ending,before 2027,kalshi
kxsecstatevisit,kxsecstatevisit-27,politics,what countries will marco rubio visit in 2026,before 2027,kalshi
kxsecquarterly,kxsecquarterly-26mar,politics,sec eliminate the quarterly reporting requirement,"before jan 1, 2027",kalshi
kxscotuscertflag,kxscotuscertflag-27jan,politics,scotus hear a case about flag burning before 2027,before 2027,kalshi
kxscotusaicopyright,kxscotusaicopyright-27jan,politics,scotus hear a case about ai and copyright law before 2027,before 2027,kalshi
kxsafebank,kxsafebank-27jan01,politics,cannabis banking insurance protections become law in 2026,"before jan 1, 2027",kalshi
kxroganguest,kxroganguest-27jan01,entertainment,go on joe rogan this year,before 2027,kalshi
kxrelocateunited,kxrelocateunited-26,companies,united airlines shift its headquarters to denver co before 2027,before 2027,kalshi
kxrecogpersoniran,kxrecogpersoniran-26,politics,united states recognize reza pahlavi as the leader of iran in 2026,before 2027,kalshi
kxrecogpalestine,kxrecogpalestine-27,politics,recognize palestine before 2027,before 2027,kalshi
kxrecnch,kxrecnch-26,politics,when will the house pass a reconciliation bill,in 2026,kalshi
kxratecut,kxratecut-26dec31,economics,fed rate cut before 2027,before 2027,kalshi
kxranklistspotifygtop3,kxranklistspotifygtop3-27jan01,entertainment,taylor swift have a top 3 song on spotify global this year,"before jan 1, 2027",kalshi
kxpublicswiftlively,kxpublicswiftlively-27jan01,entertainment,blake lively and taylor swift be seen together in public this year,"before jan 1, 2027",kalshi
kxpublicbeckham,kxpublicbeckham-27jan01,entertainment,brooklyn beckham be seen in public with david or victoria beckham this year,"before jan 1, 2027",kalshi
kxpriceincreaseapplemusic,kxpriceincreaseapplemusic-26,financials,apple music's individual plan increase before 2027,before 2027,kalshi
kxpopevisit,kxpopevisit-27jan01,world,what countries will pope leo visit before 2027,"before jan 1, 2027",kalshi
kxpopeswift,kxpopeswift-27,social,taylor swift meet with pope leo xiv before 2027,"before jan 1, 2027",kalshi
kxpolio,kxpolio-26,health,there be a case of polio in the usa this year,in 2026,kalshi
kxpodcastguestcallherdaddy,kxpodcastguestcallherdaddy-27jan,entertainment,go on call her daddy this year,in 2027,kalshi
kxpizzascore9,kxpizzascore9-26,sports,dave portnoy score any pizza place a 9.0 or higher in 2026,before 2027,kalshi
kxpermit,kxpermit-27,politics,permitting reform become law in 2026,before 2027,kalshi
kxpartyleave,kxpartyleave-27,elections,anyone else in congress change parties in 2026,before 2027,kalshi
kxpardonsyear,kxpardonsyear-26dec,politics,how many people will trump pardon in 2026,before 2027-01-01t15:00:00.000z,kalshi
kxpahlavivisita,kxpahlavivisita,politics,reza pahlavi visit iran in 2026,"before jan 1, 2027",kalshi
kxpahlavihead,kxpahlavihead-27jan,companies,reza pahlavi lead iran in 2026,before 2027,kalshi
kxoaiscreen,kxoaiscreen-27,science and technology,openai/jony ive device have a screen,before 2027,kalshi
kxoaihardware,kxoaihardware-27,science and technology,what kind of device will jony ive and openai announce,before 2027,kalshi
kxnysecircuit,kxnysecircuit-27,economics,nyse marketwide circuitbreaker happen this year,in 2026,kalshi
kxnwest,kxnwest-27,entertainment,north west album drop on spotify in 2026,in 2026,kalshi
kxnickelstop,kxnickelstop-27,politics,nickel be discontinued,"before jan 1, 2027",kalshi
kxnguardcity,kxnguardcity-26,politics,which cities will the national guard deploy to in 2026,in 2026,kalshi
kxnewxbox,kxnewxbox-xbox,companies,new xbox this year,a new xbox video game console,kalshi
kxnewtaylor-ts,kxnewtaylor-ts-27,entertainment,taylor swift (taylor's version) be announced this year,in 2027,kalshi
kxnewtaylor-r,kxnewtaylor-r-27,entertainment,reputation (taylor's version) be announced this year,in 2027,kalshi
kxnewrolex,kxnewrolex-27jan,companies,be the next ceo of x,2026,kalshi
kxnewrolefaze,kxnewrolefaze-27jan,companies,"be the next ceo of faze media, inc",before 2027,kalshi
kxnewroleceoapple,kxnewroleceoapple-27jan,companies,be the next ceo of apple,by 2027,kalshi
kxnewoutbreak-p,kxnewoutbreak-p-26,health,pandemic in 2026,in 2026,kalshi
kxnba2kcover,kxnba2kcover-27,sports,be on the cover of nba 2k27,for nba2k27,kalshi
kxmuskwealth,kxmuskwealth-27,economics,how rich will elon musk get before 2027,before 2027,kalshi
kxmusksports,kxmusksports-27,entertainment,elon musk buy a major sports team before 2027,before 2027,kalshi
kxmuskcharge,kxmuskcharge-27jan01,politics,elon musk be charged with a crime in spain or france,"before jan 1, 2027",kalshi
kxmuskbluesky,kxmuskbluesky-27,science and technology,elon make a bluesky account before 2027,before 2027,kalshi
kxmtgswitch,kxmtgswitch-27jan,elections,switch or leave their party in 2026,before jan 2027,kalshi
kxmortgagerate,kxmortgagerate-26dec,economics,how high will 30yr mortgage rate get this year,in 2026,kalshi
kxmodelhigh,kxmodelhigh-27-1550,science and technology,which ai will be the first to hit 1550 on text arena,before 2027,kalshi
kxmndaycarecharge,kxmndaycarecharge,politics,anyone be charged in the minnesota daycare fraud scandal,criminal charges,kalshi
kxmediareleasest,kxmediareleasest-27jan01,entertainment,stranger things release a new episode this year,"before jan 1, 2027",kalshi
kxmediareleasedune3,kxmediareleasedune3-du,entertainment,when will dune: part three be released,dune: part three - worldwide,kalshi
kxmayorofkingstown,kxmayorofkingstown-27jan01,entertainment,mayor of kingstown season 5 be released this year,"before jan 1, 2027",kalshi
kxmarriageswiftkelce,kxmarriageswiftkelce-26,entertainment,taylor swift and travis kelce be married this year,before 2027,kalshi
kxmarriagebelichickhudson,kxmarriagebelichickhudson-26,social,bill belichick and jordon hudson be married before 2027,before 2027,kalshi
kxmarriagebeast,kxmarriagebeast-26,entertainment,mrbeast and thea booysen be married in 2026,before 2027,kalshi
kxmaralago,kxmaralago-27,politics,visit mar-a-lago before 2027,"before jan 1, 2027",kalshi
kxmaccell,kxmaccell-27,science and technology,apple release a macbook with cellular connectivity before 2027,before 2027,kalshi
kxlucasfilm,kxlucasfilm-27,entertainment,be the next president of lucasfilm before 2027,before 2027,kalshi
kxllama5,kxllama5-27,science and technology,meta release llama 5 this year,"before jan 1, 2027",kalshi
kxleavetisch,kxleavetisch-27jan01,politics,jessica tisch out as nypd commissioner before 2027,"before jan 1, 2027",kalshi
kxleavestarmer,kxleavestarmer,politics,keir starmer out,keir starmer,kalshi
kxleavesocomcommander,kxleavesocomcommander-27jan01,politics,frank bradley out as ussocom commander,in 2026,kalshi
kxleavegrouprami,kxleavegrouprami-27,entertainment,rami leave babymonster before 2027,before 2027,kalshi
kxleadersout,kxleadersout-27jan01,politics,which world leaders will leave office in 2026,"before jan 1, 2027",kalshi
kxlargecut,kxlargecut-26,economics,fed do a rate cut greater than 25bps this year,in 2026,kalshi
kxlamineyamal,kxlamineyamal-27,sports,lamine yamal leave barcelona before 2027,"before jan 1, 2027",kalshi
kxkrakenbankpublic,kxkrakenbankpublic-27jan01,companies,which bank will take kraken public before 2027,"before jan 1, 2027",kalshi
kxkpopdh2,kxkpopdh2-26,companies,"sony pictures animation release 'kpop demon hunters 2"" before 2027",before 2027,kalshi
kxkimkbarexam,kxkimkbarexam-27,social,kim kardashian pass the bar exam before 2027,"on jan 1, 2027",kalshi
kxkanyeisrael,kxkanyeisrael,politics,kanye west / ye visit israel this year,"before jan 1, 2027",kalshi
kxjuulflavor,kxjuulflavor-27,companies,what flavors will juul relaunch,in 2027,kalshi
kxjapanfoodtax,kxjapanfoodtax-27jan01,politics,japan lower its food consumption tax in 2026,"before jan 1, 2027",kalshi
kxironman,kxironman,entertainment,robert downey jr. back as iron man this year,by 2027,kalshi
kxiranembassy,kxiranembassy-27,politics,us reopen its embassy in iran,before 2027,kalshi
kxipo,kxipo-26,companies,which companies will officially announce an ipo this year,before 2027,kalshi
kxiphonerelease,kxiphonerelease-iphone18,companies,when will apple release the iphone 18,iphone 18,kalshi
kximfrecess,kximfrecess-27,economics,imf declare a global recession before 2027,before 2027,kalshi
kxicereform,kxicereform,politics,which ice reforms will become law in 2026,"before jan 1, 2027",kalshi
kxiceero,kxiceero-26mar,politics,when will ice removal operations be funded again,legislation that funds ice's enforcement and removal operations (ero),kalshi
kxhls,kxhls-27,science and technology,spacex test its hls before 2027,before 2027,kalshi
kxhighinflation,kxhighinflation-26dec,economics,how high will cpi get this year,in 2026,kalshi
kxhfhousing,kxhfhousing-27,politics,legislation restricting institutional single-family home investment become law in 2026,before 2027,kalshi
kxhellcat,kxhellcat-27,companies,dodge release a new challenger hellcat before 2027,before 2027,kalshi
kxheisman,kxheisman-27,sports,college football heisman trophy winner,2026-2027 college football season,kalshi
kxgtemp,kxgtemp-27,climate and weather,2026 be the hottest year ever,in 2026,kalshi
kxgtemp,kxgtemp-26,climate and weather,2026 be the hottest year ever,in 2026,kalshi
kxgtedeploymegaethday1,kxgtedeploymegaethday1-27jan01,crypto,gte deploy on megaeth mainnet day 1,"before jan 1, 2027",kalshi
kxgrok,kxgrok-grok5,science and technology,when will xai release grok 5,grok 5,kalshi
kxgreenind,kxgreenind-27,elections,greenland vote for independence in 2026,before 2027,kalshi
kxgrandslamjfonseca,kxgrandslamjfonseca-26,sports,joao fonseca to win a major in 2026,in 2026,kalshi
kxgptcost,kxgptcost-27,science and technology,openai increase the cost of chatgpt,in 2026,kalshi
kxgovtfundsvotes,kxgovtfundsvotes-26mar24,politics,how many senators will vote for the next government funding bill,"before jan 1, 2027",kalshi
kxgamerelease,kxgamerelease-26,entertainment,which video games will release this year,in 2026,kalshi
kxftcnext,kxftcnext-27,politics,the ftc go after next,before 2027,kalshi
kxfrontier,kxfrontier-fron,science and technology,when will ai solve another frontier math problem,frontier math: open problems,kalshi
kxfreebuses,kxfreebuses-26,politics,nyc buses become free before 2027,in 2026,kalshi
kxfraud2020,kxfraud2020-27,politics,any court rule that the 2020 election was fraudulent,before 2027,kalshi
kxfollowercountclav,kxfollowercountclav-27,social,how many followers will clavicular have this year,"before jan 1, 2027",kalshi
kxfloydtysonfight,kxfloydtysonfight-27jan01,sports,mike tyson and floyd mayweather fight this year,2026,kalshi
kxfedgovnom,kxfedgovnom-27,elections,be nominated as a fed governor in 2026,before 2027,kalshi
kxfederalcharge,kxfederalcharge-27jan01,politics,be charged with a federal crime in 2026,"before jan 1, 2027",kalshi
kxfedend,kxfedend-27,politics,trump end the federal reserve before 2027,before 2027,kalshi
