series_id,event_id,tags,event_title,event_sub_title,platform
kxinprimary,kxinprimary-01r26,elections,in-01 republican nominee,in-01 (r),kalshi
kxinprimary,kxinprimary-01d26,elections,in-01 democratic nominee,in-01 (d),kalshi
kxgovwinomr,kxgovwinomr-26,elections,wisconsin republican governor nominee,in 2026,kalshi
kxgovvtnomr,kxgovvtnomr-262,elections,vermont republican governor nominee,in 2026,kalshi
kxgovvtnomd,kxgovvtnomd-26,elections,vermont democratic governor nominee,in 2026,kalshi
kxgovscnomr,kxgovscnomr-26,elections,south carolina republican governor nominee,in 2026,kalshi
kxgovpartyak,kxgovpartyak-26,elections,alaska governor winner (party),in 2026,kalshi
kxgovpanomr,kxgovpanomr-26,elections,pennsylvania republican governor nominee,in 2026,kalshi
kxgovornomr,kxgovornomr-26,elections,oregon republican governor nominee,in 2026,kalshi
kxgovohnomr,kxgovohnomr-26,elections,ohio republican governor nominee,in 2026,kalshi
kxgovohnomd,kxgovohnomd-26,elections,ohio democratic governor nominee,in 2026,kalshi
kxgovnmnomd,kxgovnmnomd-26,elections,new mexico democratic governor nominee,in 2026,kalshi
kxgovnhnomd,kxgovnhnomd-26,elections,new hampshire democratic governor nominee,in 2026,kalshi
kxgovmnnomr,kxgovmnnomr-26,elections,minnesota republican governor nominee,in 2026,kalshi
kxgovminomr,kxgovminomr-26,elections,michigan republican governor nominee,in 2026,kalshi
kxgovminomd,kxgovminomd-26,elections,michigan democratic governor nominee,in 2026,kalshi
kxgovmenomr,kxgovmenomr-26,elections,maine republican governor nominee,in 2026,kalshi
kxgovmenomd,kxgovmenomd-26,elections,maine democratic governor nominee,in 2026,kalshi
kxgovmdnomr,kxgovmdnomr-26,elections,maryland republican governor nominee,in 2026,kalshi
kxgovmanomr,kxgovmanomr-26,elections,massachusetts republican governor nominee,in 2026,kalshi
kxgovksnomr,kxgovksnomr-26,elections,kansas republican governor nominee,in 2026,kalshi
kxgovksnomd,kxgovksnomd-26,elections,kansas democratic governor nominee,in 2026,kalshi
kxgovianomd,kxgovianomd-26,elections,iowa democratic governor nominee,in 2026,kalshi
kxgovganomr,kxgovganomr-26,elections,georgia republican governor nominee,in 2026,kalshi
kxgovganomd,kxgovganomd-26,elections,georgia democratic governor nominee,in 2026,kalshi
kxgovflnomr,kxgovflnomr-26,elections,florida republican governor nominee,in 2026,kalshi
kxgovflnomd,kxgovflnomd-26,elections,florida democratic governor nominee,in 2026,kalshi
kxgovctnomr,kxgovctnomr-26,elections,connecticut republican governor nominee,in 2026,kalshi
kxgovconomr,kxgovconomr-26,elections,colorado republican governor nominee,in 2026,kalshi
kxgovconomd,kxgovconomd-26,elections,colorado democratic governor nominee,in 2026,kalshi
kxgovaznomr,kxgovaznomr-26,elections,arizona republican governor nominee,in 2026,kalshi
kxgopsenateprimarycombo,kxgopsenateprimarycombo-26nov03,elections,2026 republican senate primaries combo,in 2026,kalshi
kxgasosr,kxgasosr-26,elections,georgia republican secretary of state nominee,in 2026,kalshi
kxga14r,kxga14r-26,elections,ga-14 republican nominee,in 2026,kalshi
kxflprimary,kxflprimary-23d26,elections,fl-23 democratic nominee,fl-23 (d),kalshi
kxfestivaleventrncmidterms,kxfestivaleventrncmidterms-26nov03,politics,republicans hold a midterm convention,"before nov 3, 2026",kalshi
kxfestivaleventdncmidterms,kxfestivaleventdncmidterms-26nov03,politics,democrats hold a midterm convention,"before nov 3, 2026",kalshi
kxelectionemergency,kxelectionemergency,politics,trump declare an election emergency,executive action timing,kalshi
kxdemswingstategovsweep,kxdemswingstategovsweep-26nov03,elections,democrats sweep all swing state governor races,"on nov 3, 2026",kalshi
kxdemsenateprimarycombo,kxdemsenateprimarycombo-26nov03,elections,2026 democratic senate primaries combo,in 2026,kalshi
kxdemprogressivesenatesweep,kxdemprogressivesenatesweep-26nov03,elections,democratic senate primaries: progressives sweep,in 2026,kalshi
kxdcmayord,kxdcmayord-26,elections,win the 2026 dc democratic mayoral primary,in 2026,kalshi
kxdcdeld,kxdcdeld-26,elections,dc democratic house delegate nominee,in 2026,kalshi
kxcawealthtax,kxcawealthtax-26,elections,california billionaire wealth tax pass,in 2026,kalshi
kxcavoterid,kxcavoterid-26,elections,california voter id initiative pass,in 2026,kalshi
kxcaprimary,kxcaprimary-4826,elections,advance in the ca-48 primary,in 2026,kalshi
kxcabillionairetax,kxcabillionairetax-26nov03,elections,california billionaire wealth tax appear on the ballot,"before nov 3, 2026",kalshi
kxca11primary,kxca11primary-26,elections,advance from the ca-11 primary,in 2026,kalshi
kxca04primary,kxca04primary-26,elections,ca-04 primary advancers,in 2026,kalshi
kxbernieendorse,kxbernieendorse-26nov03,elections,bernie sanders endorse before the midterms,"before nov 3, 2026",kalshi
kxaz01r,kxaz01r-26,elections,az-01 republican nominee,in 2026,kalshi
kxagnomrok,kxagnomrok-26,elections,oklahoma republican attorney general nominee,in 2026,kalshi
kxaaagased,kxaaagased-26nov03,economics,us gas prices on election day,"on nov 3, 2026",kalshi
kxstephdeal,kxstephdeal-26,sports,stephen curry: anta partnership,"before nov 1, 2026",kalshi
kxsongreleasedatepc,kxsongreleasedatepc-26,entertainment,when will playboi carti release a new song,before nov 2026,kalshi
kxredistricting,kxredistricting-26,elections,which states will redistrict before the midterms,before 2026,kalshi
kxmlbplayoffs,kxmlbplayoffs-26,sports,pro baseball playoff qualifiers,2026,kalshi
kxkleague,kxkleague-26,sports,korea k league 1 champion,2026 season,kalshi
kxwildsht,kxwildsht-26,economics,which wildlife will be on the bank of england banknote shortlist,in 2026,kalshi
kxteamsinws,kxteamsinws-26,sports,pro baseball championship series matchup,2026,kalshi
kxmlbnlwest,kxmlbnlwest-26,sports,nl west division winner,2026,kalshi
kxmlbnleast,kxmlbnleast-26,sports,nl east division winner,2026,kalshi
kxmlbnlcent,kxmlbnlcent-26,sports,nl central division winner,2026,kalshi
kxmlbnl,kxmlbnl-26,sports,national league champion,2026,kalshi
kxmlbalwest,kxmlbalwest-26,sports,al west division winner,2026,kalshi
kxmlbaleast,kxmlbaleast-26,sports,al east division winner,2026,kalshi
kxmlbalcent,kxmlbalcent-26,sports,al central division winner,2026,kalshi
kxmlbal,kxmlbal-26,sports,american league champion,2026,kalshi
kxmlb,kxmlb-26,sports,pro baseball champion,2026,kalshi
kxlbjretire,kxlbjretire-26,sports,lebron james announces retirement before the 2026-27 season,before the start of the 2026-27 regular season,kalshi
kxpcecore,kxpcecore-26sep,economics,how much will core pce increase in sep 2026,in sep 2026,kalshi
kxfeddecision,kxfeddecision-26oct,economics,fed decision in oct 2026,"on oct 28, 2026",kalshi
kxfed,kxfed-26oct,economics,fed funds rate after oct 2026 meeting,"on oct 28, 2026",kalshi
kxcbdecisioncanada,kxcbdecisioncanada-26oct,world,bank of canada decision in oct 2026,in oct 2026,kalshi
kxisraelknesset,kxisraelknesset-26,elections,win the next israeli legislative election,in 2026,kalshi
kxtorontomayor,kxtorontomayor-26oct26,elections,win the 2026 toronto mayoral election,in 2026,kalshi
kxottawamayor,kxottawamayor-26oct26,elections,win the 2026 ottawa mayoral election,in 2026,kalshi
kxbrpres,kxbrpres-26,elections,brazil presidential election winner,in the next presidential election,kalshi
kxnextteamnba,kxnextteamnba-26ljam,sports,lebron james's next team,lebron james,kalshi
kxnextteamnba,kxnextteamnba-26zwil,sports,zion williamson's next team,zion williamson,kalshi
kxnextteamnba,kxnextteamnba-26jran,sports,julius randle's next team,julius randle,kalshi
kxnextteamnba,kxnextteamnba-26jgid,sports,josh giddey's next team,josh giddey,kalshi
kxnextteamnba,kxnextteamnba-26jamor,sports,ja morant's next team,ja morant,kalshi
kxnextteamnba,kxnextteamnba-26jahar,sports,james harden's next team,james harden,kalshi
kxnextteamnba,kxnextteamnba-26gant,sports,giannis antetokounmpo's next team,giannis antetokounmpo,kalshi
kxnextteamnba,kxnextteamnba-26dgre,sports,draymond green's next team,draymond green,kalshi
kxnextteamnba,kxnextteamnba-26dboo,sports,devin booker's next team,devin booker,kalshi
kxvancouvermayor,kxvancouvermayor-26oct17,elections,win the 2026 vancouver mayoral election,in 2026,kalshi
kxmlbworstrecord,kxmlbworstrecord-26,sports,pro baseball worst record,2026,kalshi
kxmlbbestrecord,kxmlbbestrecord-26,sports,pro baseball best record,2026,kalshi
kxleadermlbwins,kxleadermlbwins-26,sports,pro baseball wins leader,2026 regular season,kalshi
kxleadermlbwar,kxleadermlbwar-26,sports,pro baseball war (wins above replacement) leader,2026 regular season,kalshi
kxleadermlbtriples,kxleadermlbtriples-26,sports,pro baseball triples leader,2026 regular season,kalshi
kxleadermlbsteals,kxleadermlbsteals-26,sports,pro baseball steals leader,2026 regular season,kalshi
kxleadermlbruns,kxleadermlbruns-26,sports,pro baseball runs leader,2026 regular season,kalshi
kxleadermlbrbi,kxleadermlbrbi-26,sports,pro baseball rbis leader,2026 regular season,kalshi
kxleadermlbops,kxleadermlbops-26,sports,pro baseball ops leader,2026 regular season,kalshi
kxleadermlbhr,kxleadermlbhr-26,sports,pro baseball home runs leader,2026 regular season,kalshi
kxleadermlbhits,kxleadermlbhits-26,sports,pro baseball hits leader,2026 regular season,kalshi
kxleadermlbera,kxleadermlbera-26,sports,pro baseball lowest era,2026 regular season,kalshi
kxleadermlbdoubles,kxleadermlbdoubles-26,sports,pro baseball doubles leader,2026 regular season,kalshi
kxleadermlbavg,kxleadermlbavg-26,sports,pro baseball batting average leader,2026 regular season,kalshi
kxeconstatcpiyoy,kxeconstatcpiyoy-26sep,economics,cpi year-over-year in sep 2026,in sep 2026,kalshi
kxeconstatcpicore,kxeconstatcpicore-26sep,economics,cpi core month-over-month in sep 2026,in sep 2026,kalshi
kxeconstatcpi,kxeconstatcpi-26sep,economics,cpi month-over-month in sep 2026,in sep 2026,kalshi
kxeconstatcorecpiyoy,kxeconstatcorecpiyoy-26sep,economics,cpi core year-over-year in sep 2026,in sep 2026,kalshi
kxcpi,kxcpi-26sep,economics,cpi in september,in sep 2026,kalshi
kxquebecassembly,kxquebecassembly-26oct05,elections,win the 2026 quebec national assembly election,in 2026,kalshi
kxslrchamp,kxslrchamp-26,sports,super league rugby champion,2026,kalshi
kxbrpres1r,kxbrpres1r-26oct04,elections,brazil presidential election: first round winner,brazilian presidential election,kalshi
kxbrballot,kxbrballot-26,elections,run for president of brazil,in the next first round,kalshi
kxbrazilsenate,kxbrazilsenate-26oct04,elections,win the 2026 brazilian senate election,"on oct 4, 2026",kalshi
kxpayrolls,kxpayrolls-26sep,economics,jobs numbers in sep 2026,in sep 2026,kalshi
kxeconstatu3,kxeconstatu3-26sep,economics,unemployment rate in sep 2026,in sep 2026,kalshi
kxmlbwstreak,kxmlbwstreak-26,sports,longest regular season winning streak,2026,kalshi
kxmlbseasonhr,kxmlbseasonhr-26c60,sports,pro baseball: 60+ home run season,60+ home runs,kalshi
kxmlbseasonhr,kxmlbseasonhr-26c50,sports,pro baseball: 50+ home run season,50+ home runs,kalshi
kxmlbseasonhr,kxmlbseasonhr-26c40,sports,pro baseball: 40+ home run season,40+ home runs,kalshi
kxmlbseasonhr,kxmlbseasonhr-26c30,sports,pro baseball: 30+ home run season,30+ home runs,kalshi
kxmlbseasonhr,kxmlbseasonhr-26c20,sports,pro baseball: 20+ home run season,20+ home runs,kalshi
kxmlblstreak,kxmlblstreak-26,sports,longest regular season losing streak,2026,kalshi
kxswedenparli,kxswedenparli-26,elections,win the next swedish general election,in 2026,kalshi
kxpcecore,kxpcecore-26aug,economics,how much will core pce increase in aug 2026,in aug 2026,kalshi
kxadp,kxadp-26sep,economics,adp employment change in sep 2026,in sep 2026,kalshi
kxdealr,kxdealr-26,elections,de-al republican nominee,in 2026,kalshi
kxboxing,kxboxing-26sep19fmaympac,sports,mayweather vs pacquiao,floyd mayweather jr. vs manny pacquiao (sep 19),kalshi
kxfeddecision,kxfeddecision-26sep,economics,fed decision in sep 2026,"on sep 16, 2026",kalshi
kxfed,kxfed-26sep,economics,fed funds rate after sep 2026 meeting,"on sep 16, 2026",kalshi
kxtrumpendorse,kxtrumpendorse-26sep15,elections,trump endorse in the 2026 primaries,"before sep 15, 2026",kalshi
kxstartingqbweek1,kxstartingqbweek1-w1-26sep15-pit,sports,pittsburgh week 1 starting quarterback,"pit, week 1, 2026-27",kalshi
kxstartingqbweek1,kxstartingqbweek1-w1-26sep15-mia,sports,miami week 1 starting quarterback,"mia, week 1, 2026-27",kalshi
kxstartingqbweek1,kxstartingqbweek1-w1-26sep15-kc,sports,kansas city week 1 starting quarterback,"kc, week 1, 2026-27",kalshi
kxstartingqbweek1,kxstartingqbweek1-w1-26sep15-cle,sports,cleveland week 1 starting quarterback,"cle, week 1, 2026-27",kalshi
kxstartingqbweek1,kxstartingqbweek1-w1-26sep15-ari,sports,arizona week 1 starting quarterback,"ari, week 1, 2026-27",kalshi
kxsoccertransfer,kxsoccertransfer-26sum,sports,"which soccer players will transfer clubs before sep 15, 2026","before sep 15, 2026",kalshi
kxsenatemad,kxsenatemad-26,elections,massachusetts democratic senate nominee,in 2026,kalshi
kxma05d,kxma05d-26,elections,ma-05 democratic nominee,in 2026,kalshi
kxgrandslam,kxgrandslam-jsin26,sports,how many grand slams will jannik sinner win in 2026,2026 jannik sinner grand slams,kalshi
kxgrandslam,kxgrandslam-calc26,sports,how many grand slams will carlos alcaraz win in 2026,2026 carlos alcaraz grand slams,kalshi
kxstartingqbweek1,kxstartingqbweek1-w1-26sep14-nyj,sports,new york j week 1 starting quarterback,"nyj, week 1, 2026-27",kalshi
kxkelceretire,kxkelceretire-26,sports,travis kelce announce his retirement before next season,before the start of the 2026-27 regular season,kalshi
kxgolftennismajors,kxgolftennismajors-26,sports,win more major tournaments this year,golf/tennis majors,kalshi
kxindycarseries,kxindycarseries-nttics26,sports,ntt indycar series champion,ntt indycar series,kalshi
kxpgasolheim,kxpgasolheim-sc26,sports,solheim cup champion,2026 solheim cup,kalshi
kxeconstatcpiyoy,kxeconstatcpiyoy-26aug,economics,cpi year-over-year in aug 2026,in aug 2026,kalshi
kxeconstatcpicore,kxeconstatcpicore-26aug,economics,cpi core month-over-month in aug 2026,in aug 2026,kalshi
kxeconstatcpi,kxeconstatcpi-26aug,economics,cpi month-over-month in aug 2026,in aug 2026,kalshi
kxeconstatcorecpiyoy,kxeconstatcorecpiyoy-26aug,economics,cpi core year-over-year in aug 2026,in aug 2026,kalshi
kxcpi,kxcpi-26aug,economics,cpi in august,in aug 2026,kalshi
kxsenaterir,kxsenaterir-26,elections,rhode island republican senate nominee,in 2026,kalshi
kxsenaterid,kxsenaterid-26,elections,rhode island democratic senate nominee,in 2026,kalshi
kxma6d,kxma6d-26,elections,ma-06 democratic nominee,in 2026,kalshi
kxgovrinomr,kxgovrinomr-26,elections,rhode island republican governor nominee,in 2026,kalshi
kxgovrinomd,kxgovrinomd-26,elections,rhode island democratic governor nominee,in 2026,kalshi
kxpayrolls,kxpayrolls-26aug,economics,jobs numbers in aug 2026,in aug 2026,kalshi
kxeconstatu3,kxeconstatu3-26aug,economics,unemployment rate in aug 2026,in aug 2026,kalshi
kxarodgretire,kxarodgretire-26,sports,aaron rodgers retire before the 2026-2027 season,before the 2026-27 season,kalshi
kxadp,kxadp-26aug,economics,adp employment change in aug 2026,in aug 2026,kalshi
kxcbdecisioncanada,kxcbdecisioncanada-26sep,world,bank of canada decision in sep 2026,in sep 2026,kalshi
kxnextteamnfl,kxnextteamnfl-26jburrow,sports,joe burrow's next team,joe burrow,kalshi
kxnextteamnfl,kxnextteamnfl-26dnjoku,sports,david njoku's next team,david njoku,kalshi
kxncaafaprank,kxncaafaprank-26w1r1,sports,#1 ranked team on college football ap poll week 1 rankings,#1 week 1,kalshi
kxcoachoutnfl,kxcoachoutnfl,sports,which pro football coaches will be out before september,"sep 1, 2026",kalshi
kxcoachoutncaafb,kxcoachoutncaafb-1-26,sports,which college football coaches will be out before september,"on sep 1, 2026",kalshi
kxwa4primary,kxwa4primary-26,elections,advance from the wa-04 primary,in 2026,kalshi
kxtopmonthly,kxtopmonthly-26aug,entertainment,artist with the most monthly spotify listeners at the end of aug 2026,"on aug 31, 2026",kalshi
kxgovwynomr,kxgovwynomr-26,elections,wyoming republican governor nominee,in 2026,kalshi
kxgovwinomd,kxgovwinomd-26,elections,wisconsin democratic governor nominee,in 2026,kalshi
kxgovtnnomr,kxgovtnnomr-2-26,elections,tennessee republican governor nominee,in 2026,kalshi
kxgovctnomd,kxgovctnomd-26,elections,connecticut democratic governor nominee,in 2026,kalshi
kxgovakprimary,kxgovakprimary-26,elections,advance from alaska's top-four primary for governor,in 2026,kalshi
kxaz5r,kxaz5r-26,elections,az-05 republican nominee,in 2026,kalshi
kxpcecore,kxpcecore-26jul,economics,how much will core pce increase in jul 2026,in jul 2026,kalshi
kxltgovoknomr,kxltgovoknomr-26,elections,oklahoma republican lieutenant governor nominee,in 2026,kalshi
kxgovmnnomd,kxgovmnnomd-26,elections,minnesota democratic governor nominee,in 2026,kalshi
kxfl19r,kxfl19r-26,elections,fl-19 republican nominee,in 2026,kalshi
kxendorsefishback,kxendorsefishback-26aug18,elections,endorse james fishback,"before aug 18, 2026",kalshi
kxnextmanagerepl,kxnextmanagerepl-26tot,sports,be the next manager of tottenham,tottenham,kalshi
kxhi01d,kxhi01d-26,elections,hi-01 democratic nominee,in 2026,kalshi
kxzambiaassembly,kxzambiaassembly-26,elections,win the next zambian national assembly election,in 2026,kalshi
kxeconstatcpiyoy,kxeconstatcpiyoy-26jul,economics,cpi year-over-year in jul 2026,in jul 2026,kalshi
kxeconstatcpicore,kxeconstatcpicore-26jul,economics,cpi core month-over-month in jul 2026,in jul 2026,kalshi
kxeconstatcpi,kxeconstatcpi-26jul,economics,cpi month-over-month in jul 2026,in jul 2026,kalshi
kxeconstatcorecpiyoy,kxeconstatcorecpiyoy-26jul,economics,cpi core year-over-year in jul 2026,in jul 2026,kalshi
kxcpi,kxcpi-26jul,economics,cpi in july,in jul 2026,kalshi
kxsenatemnr,kxsenatemnr-26,elections,minnesota republican senate nominee,in 2026,kalshi
kxmn2d,kxmn2d-26,elections,mn-02 democratic nominee,in 2026,kalshi
kxagnommir,kxagnommir-26,elections,michigan republican attorney general nominee,in 2026,kalshi
kxagnommid,kxagnommid-26,elections,michigan democratic attorney general nominee,in 2026,kalshi
kxagnomazr,kxagnomazr-26,elections,arizona republican attorney general nominee,in 2026,kalshi
kxpayrolls,kxpayrolls-26jul,economics,jobs numbers in jul 2026,in jul 2026,kalshi
kxeconstatu3,kxeconstatu3-26jul,economics,unemployment rate in jul 2026,in jul 2026,kalshi
kxgovtnnomd,kxgovtnnomd-26,elections,tennessee democratic governor nominee,in 2026,kalshi
kxperuimpeach,kxperuimpeach-26jul29,politics,josé maría balcázar be impeached,"before jul 29, 2026",kalshi
kxadp,kxadp-26jul,economics,adp employment change in jul 2026,in jul 2026,kalshi
kxsenatemir,kxsenatemir-26,elections,michigan republican senate nominee,in 2026,kalshi
kxnh1d,kxnh1d-26,elections,nh-01 democratic nominee,in 2026,kalshi
kxmi11d,kxmi11d-26,elections,mi-11 democratic nominee,in 2026,kalshi
kxannarbormayord,kxannarbormayord-26,elections,ann arbor democratic mayoral primary winner,in 2026,kalshi
kxncaabbgs,kxncaabbgs-26,sports,golden spikes award winner,2026 college baseball season,kalshi
kxwsopentrants,kxwsopentrants-26,sports,"2026 wsop main event have over 10,000 entries",2026 wsop,kalshi
kxwatsonrnc,kxwatsonrnc,politics,scotus bar counting mail ballots after election day,before 2026,kalshi
kxvrascotusvote,kxvrascotusvote-26,politics,how many justices will vote for louisiana in louisiana v. callais,before aug 2026,kalshi
kxtrumpslaughtervote,kxtrumpslaughtervote-26,politics,how many justices will vote for trump in the ftc removal case,before 2026,kalshi
kxscotusvra2,kxscotusvra2,politics,scotus weaken the voting rights act,before 2026,kalshi
kxscotusmarijuanagun,kxscotusmarijuanagun,politics,scotus uphold the federal gun ban for marijuana users,before 2026,kalshi
kxnextmanagermanu,kxnextmanagermanu-26,sports,be the next manager of manchester united,2026,kalshi
kxleavepowellgov,kxleavepowellgov-26aug01,politics,jerome powell out as fed governor,in 2026,kalshi
kxcriticality,kxcriticality-26aug,science and technology,which nuclear power companies will achieve criticality before aug 2026,before aug 2026,kalshi
kxwcgoalleader,kxwcgoalleader-26,sports,fifa world cup golden boot winner,2026 world cup full tournament,kalshi
kxubertrips,kxubertrips-26jul,companies,uber trips in q1,in q1 2026,kalshi
kxspotifymau,kxspotifymau-26jul,companies,spotify monthly active users in q1,in q1 2026,kalshi
kxsoccerplaymessi,kxsoccerplaymessi-26,sports,lionel messi play in the world cup,in 2026,kalshi
kxmetaheadcount,kxmetaheadcount-26jul,companies,meta headcount in q1,in q1 2026,kalshi
kxdashorders,kxdashorders-26jul,companies,doordash total orders in q1,in q1 2026,kalshi
kxboeing,kxboeing-26jul,companies,boeing deliveries in q1,in q1 2026,kalshi
kxapfddh,kxapfddh-26,sports,apf division de honor apertura champion,2026 season,kalshi
kxdota2map,kxdota2map-26mar27pariflc-2,sports,esl one birmingham 2026: parivision vs. team falcons map 2,map 2: pari vs. flc (mar 27),kalshi
kxdota2map,kxdota2map-26mar27pariflc-1,sports,esl one birmingham 2026: parivision vs. team falcons map 1,map 1: pari vs. flc (mar 27),kalshi
kxmlbmention,kxmlbmention-26mar26pitnym,mentions,announcers at pittsburgh vs new york m professional baseball game,pittsburgh vs new york m professional baseball game,kalshi
kxmlbmention,kxmlbmention-26mar28minbal,mentions,announcers at minnesota vs baltimore professional baseball game,minnesota vs baltimore professional baseball game,kalshi
kxmlbmention,kxmlbmention-26mar28clesea,mentions,announcers at cleveland vs seattle professional baseball game,cleveland vs seattle professional baseball game,kalshi
kxmlbmention,kxmlbmention-26mar27laahou,mentions,announcers at los angeles a vs houston professional baseball game,los angeles a vs houston professional baseball game,kalshi
kxatpchallengermatch,kxatpchallengermatch-26mar26altgue,sports,altmaier vs guerrieri,altmaier vs guerrieri (mar 26),kalshi
kxatpchallengermatch,kxatpchallengermatch-26mar26dalgiu,sports,dalla valle vs giustino,dalla valle vs giustino (mar 26),kalshi
kxdota2game,kxdota2game-26mar27pariflc,sports,parivision vs. team falcons,parivision vs. team falcons (mar 27),kalshi
kxmlbmention,kxmlbmention-26mar26azlad,mentions,announcers at arizona vs los angeles d professional baseball game,arizona vs los angeles d professional baseball game,kalshi
kxpgar3lead,kxpgar3lead-techo26,sports,texas children's houston open end of round 3 leader,2026 texas children's houston open,kalshi
kxnhltotal,kxnhltotal-26mar28njcar,sports,new jersey at carolina: total points,nj at car (mar 28),kalshi
kxnhlspread,kxnhlspread-26mar28njcar,sports,new jersey at carolina: spread,nj at car (mar 28),kalshi
kxpgar2lead,kxpgar2lead-techo26,sports,texas children's houston open end of round 2 leader,2026 texas children's houston open,kalshi
kxnhlgame,kxnhlgame-26mar28njcar,sports,new jersey at carolina,nj at car (mar 28),kalshi
kxnhltotal,kxnhltotal-26mar28anaedm,sports,anaheim at edmonton: total points,ana at edm (mar 28),kalshi
kxnhltotal,kxnhltotal-26mar28dalpit,sports,dallas at pittsburgh: total points,dal at pit (mar 28),kalshi
kxnhlspread,kxnhlspread-26mar28anaedm,sports,anaheim at edmonton: spread,ana at edm (mar 28),kalshi
kxnhlspread,kxnhlspread-26mar28dalpit,sports,dallas at pittsburgh: spread,dal at pit (mar 28),kalshi
kxnhlgame,kxnhlgame-26mar28anaedm,sports,anaheim at edmonton,ana at edm (mar 28),kalshi
kxnhlgame,kxnhlgame-26mar28dalpit,sports,dallas at pittsburgh,dal at pit (mar 28),kalshi
kxpgar1lead,kxpgar1lead-techo26,sports,texas children's houston open end of round 1 leader,2026 texas children's houston open,kalshi
kxnhltotal,kxnhltotal-26mar28minbos,sports,minnesota at boston: total points,min at bos (mar 28),kalshi
kxpgar1top10,kxpgar1top10-techo26,sports,texas children's houston open: round 1 top 10 finishers,2026 texas children's houston open,kalshi
kxnhlspread,kxnhlspread-26mar28minbos,sports,minnesota at boston: spread,min at bos (mar 28),kalshi
kxnhltotal,kxnhltotal-26mar28seabuf,sports,seattle at buffalo: total points,sea at buf (mar 28),kalshi
kxnhlgame,kxnhlgame-26mar28minbos,sports,minnesota at boston,min at bos (mar 28),kalshi
kxnhlspread,kxnhlspread-26mar28seabuf,sports,seattle at buffalo: spread,sea at buf (mar 28),kalshi
kxnhlgame,kxnhlgame-26mar28seabuf,sports,seattle at buffalo,sea at buf (mar 28),kalshi
kxpgar1top5,kxpgar1top5-techo26,sports,texas children's houston open: round 1 top 5 finishers,2026 texas children's houston open,kalshi
kxnhltotal,kxnhltotal-26mar28sjcbj,sports,san jose at columbus: total points,sj at cbj (mar 28),kalshi
kxnhlspread,kxnhlspread-26mar28sjcbj,sports,san jose at columbus: spread,sj at cbj (mar 28),kalshi
kxatpchallengermatch,kxatpchallengermatch-26mar26marber,sports,martinez vs bertola,martinez vs bertola (mar 26),kalshi
kxnhlgame,kxnhlgame-26mar28sjcbj,sports,san jose at columbus,sj at cbj (mar 28),kalshi
kxpgamakecut,kxpgamakecut-techo26,sports,texas children's houston open: to make the cut,2026 texas children's houston open,kalshi
kxpgatop5,kxpgatop5-techo26,sports,texas children's houston open: top 5 finishers,2026 texas children's houston open,kalshi
kxpgatop10,kxpgatop10-techo26,sports,texas children's houston open: top 10 finishers,2026 texas children's houston open,kalshi
kxpgatop20,kxpgatop20-techo26,sports,texas children's houston open: top 20 finishers,2026 texas children's houston open,kalshi
kxpgatour,kxpgatour-techo26,sports,texas children's houston open winner,2026 texas children's houston open,kalshi
kxatpchallengermatch,kxatpchallengermatch-26mar26mrvcop,sports,mrva vs coppejans,mrva vs coppejans (mar 26),kalshi
kxatpchallengermatch,kxatpchallengermatch-26mar26couvas,sports,coulibaly vs vasilev,coulibaly vs vasilev (mar 26),kalshi
kxatpchallengermatch,kxatpchallengermatch-26mar26genrom,sports,gentzsch vs romano,gentzsch vs romano (mar 26),kalshi
